{
  "slug": "bellman-ford",
  "categoryId": "graphs",
  "order": 4,
  "title": "Bellman-Ford",
  "tagline": "Shortest paths that tolerate negative edges — and detect negative cycles.",
  "estMinutes": 16,
  "simulator": null,
  "complexity": { "time": "O(V·E)", "space": "O(V)" },
  "tags": ["shortest path", "negative edges", "relaxation"],
  "intuition": {
    "analogy": "Rumours spreading through an office: after one round everyone one desk away knows; after two rounds, two desks away. After V−1 rounds, the news has had time to travel the longest possible simple path to everyone.",
    "paragraphs": [
      "Dijkstra's greedy choice fails with negative edges. Bellman-Ford instead brute-forces correctness: it relaxes every edge repeatedly. After k rounds, all shortest paths using at most k edges are correct.",
      "A shortest path in a graph with V vertices uses at most V−1 edges, so V−1 rounds of relaxing all edges settles every distance.",
      "Bonus: if a V-th round still improves some distance, a negative-weight cycle exists (reachable from the source). That detection ability is unique and valuable — e.g. arbitrage detection in currency graphs."
    ],
    "keyIdea": "Relax all edges V−1 times; one more improving round signals a negative cycle."
  },
  "logic": {
    "steps": [
      { "title": "Initialise", "detail": "dist[src] = 0, others ∞." },
      { "title": "Relax V−1 times", "detail": "Repeat V−1 rounds; in each, for every edge (u,v,w): if dist[u]+w < dist[v], update dist[v]." },
      { "title": "Detect negative cycles", "detail": "Run one extra round. Any edge that still relaxes proves a reachable negative cycle." }
    ],
    "code": {
      "language": "python",
      "title": "bellman_ford.py",
      "source": "def bellman_ford(n, edges, src):\n    INF = float('inf')\n    dist = [INF]*n; dist[src] = 0\n    for _ in range(n - 1):\n        for u, v, w in edges:\n            if dist[u] != INF and dist[u] + w < dist[v]:\n                dist[v] = dist[u] + w\n    for u, v, w in edges:                 # extra round\n        if dist[u] != INF and dist[u] + w < dist[v]:\n            return None                   # negative cycle\n    return dist"
    },
    "complexity": {
      "time": "O(V·E)",
      "timeReason": "V−1 rounds, each scanning all E edges.",
      "space": "O(V)",
      "spaceReason": "Distance array only."
    },
    "pitfalls": [
      "Skip edges from unreached nodes (dist == ∞) to avoid spurious updates.",
      "It's much slower than Dijkstra — only use it when negatives or cycle detection are needed.",
      "Negative-cycle detection only catches cycles reachable from the source."
    ]
  },
  "dryRun": {
    "input": "Edges A→B(4), A→C(2), C→B(-3), B→D(2)",
    "columns": ["Round", "Updates", "Distances"],
    "rows": [
      ["1", "B=4, C=2, then C→B makes B=-1, D=1", "A0 B-1 C2 D1"],
      ["2", "no further improvement", "stable"],
      ["check", "no relaxations", "no negative cycle"]
    ],
    "clickMoment": "The negative edge C→B pulls B's distance below its direct value. Dijkstra would have already finalised B at 4 and missed this — repeated relaxation is what saves Bellman-Ford."
  },
  "problems": [
    { "id": "bf1", "title": "Cheapest Flights Within K Stops", "difficulty": "Medium", "statement": "Cheapest price with at most K stops.", "hint": "Bellman-Ford limited to K+1 relaxation rounds.", "tests": "Bounded-edge relaxation.", "link": "https://leetcode.com/problems/cheapest-flights-within-k-stops/" },
    { "id": "bf2", "title": "Network Delay Time", "difficulty": "Medium", "statement": "Time to reach all nodes from a source.", "hint": "Bellman-Ford also solves it (slower than Dijkstra).", "tests": "Single-source shortest path.", "link": "https://leetcode.com/problems/network-delay-time/" },
    { "id": "bf3", "title": "Detect Negative Cycle", "difficulty": "Medium", "statement": "Determine if a weighted digraph has a negative cycle.", "hint": "Run the extra relaxation round.", "tests": "Negative-cycle detection.", "link": "https://www.spoj.com/problems/NEGCYC/" },
    { "id": "bf4", "title": "Arbitrage Detection", "difficulty": "Hard", "statement": "Detect profitable currency arbitrage.", "hint": "Use −log(rate) as weights; a negative cycle means arbitrage.", "tests": "Modeling with log weights.", "link": "https://open.kattis.com/problems/arbitrage" },
    { "id": "bf5", "title": "Shortest Path with Negative Weights", "difficulty": "Medium", "statement": "Single-source shortest paths allowing negatives.", "hint": "Direct Bellman-Ford.", "tests": "General relaxation.", "link": "https://cses.fi/problemset/task/1673" }
  ]
}
