{
  "slug": "quick-sort",
  "categoryId": "sorting-searching",
  "order": 4,
  "title": "Quick Sort",
  "tagline": "Pick a pivot, partition around it, recurse — the in-place sort that's fast in practice.",
  "estMinutes": 22,
  "simulator": "quick-sort",
  "complexity": { "time": "O(n log n) avg", "space": "O(log n)" },
  "tags": ["divide & conquer", "partition", "in-place"],
  "intuition": {
    "analogy": "To organise a room of people by height, pick one person (the pivot) and ask everyone shorter to stand on the left, taller on the right. Now the pivot is in its final spot, and you repeat within each side. Each side is a smaller version of the same problem.",
    "paragraphs": [
      "Quick sort flips merge sort's strategy. Instead of doing trivial splits and hard merges, it does a hard split (partitioning) and a trivial combine (nothing — the pieces are already in the right regions). After partitioning, the pivot sits at its final sorted position.",
      "Partitioning is the heart of it: scan the range, moving everything smaller than the pivot to the front. When done, swap the pivot into the boundary. Everything left is smaller, everything right is larger.",
      "With balanced pivots you halve the range each time → O(n log n). With unlucky pivots (e.g. already-sorted input + last-element pivot) you peel off one element at a time → O(n²). Randomising or using median-of-three pivots makes the bad case astronomically unlikely."
    ],
    "keyIdea": "Partition places the pivot in its final position and splits the rest into 'smaller' and 'larger' regions to recurse on."
  },
  "logic": {
    "steps": [
      { "title": "Choose a pivot", "detail": "A common choice is the last element. Randomised or median-of-three pivots avoid worst-case behaviour on sorted/adversarial inputs." },
      { "title": "Partition (Lomuto scheme)", "detail": "Keep a boundary i. Scan j across the range; whenever a[j] < pivot, swap it to position i and advance i. Finally swap the pivot into position i." },
      { "title": "Recurse on both sides", "detail": "The pivot at i is final. Recurse on [l, i-1] and [i+1, r]. Recurse into the smaller side first to bound stack depth at O(log n)." }
    ],
    "code": {
      "language": "cpp",
      "title": "quick_sort.cpp",
      "source": "int partition(vector<int>& a, int l, int r) {\n    int pivot = a[r], i = l;\n    for (int j = l; j < r; ++j)\n        if (a[j] < pivot) swap(a[i++], a[j]);\n    swap(a[i], a[r]);\n    return i;\n}\nvoid quickSort(vector<int>& a, int l, int r) {\n    if (l >= r) return;\n    int p = partition(a, l, r);\n    quickSort(a, l, p - 1);\n    quickSort(a, p + 1, r);\n}"
    },
    "complexity": {
      "time": "O(n log n) average, O(n²) worst",
      "timeReason": "Balanced partitions give log n levels of O(n) work. Consistently lopsided partitions degrade to quadratic.",
      "space": "O(log n)",
      "spaceReason": "In-place partitioning; recursion stack is O(log n) with the smaller-side-first trick."
    },
    "pitfalls": [
      "Always picking the first/last element as pivot makes sorted input hit the O(n²) worst case — randomise.",
      "Quick sort is not stable; equal elements may be reordered.",
      "Deep recursion on lopsided splits can overflow the stack — recurse into the smaller part, loop on the larger."
    ]
  },
  "dryRun": {
    "input": "a = [5, 2, 8, 1], pivot = last",
    "columns": ["Step", "State", "Note"],
    "rows": [
      ["pivot", "[5,2,8,(1)]", "Pivot = 1"],
      ["scan", "[5,2,8,1]", "No element < 1, boundary stays at index 0"],
      ["place", "[1,2,8,5]", "Swap pivot into index 0 — 1 is final"],
      ["recurse", "[1 | 2,8,5]", "Sort the right side similarly"]
    ],
    "clickMoment": "After one partition the pivot never moves again. The sort is just 'fix one element's final spot, then conquer the leftovers' applied recursively."
  },
  "problems": [
    { "id": "qs1", "title": "Sort an Array", "difficulty": "Medium", "statement": "Sort an array; practise an in-place quicksort with random pivots.", "hint": "Randomise the pivot to dodge the sorted-input worst case.", "tests": "Partition + recursion.", "link": "https://leetcode.com/problems/sort-an-array/" },
    { "id": "qs2", "title": "Kth Largest Element", "difficulty": "Medium", "statement": "Find the kth largest element in an unsorted array.", "hint": "Quickselect: partition, then recurse only into the side that contains rank k — average O(n).", "tests": "Quickselect (partition without full sort).", "link": "https://leetcode.com/problems/kth-largest-element-in-an-array/" },
    { "id": "qs3", "title": "Sort Colors", "difficulty": "Medium", "statement": "Sort an array of 0s, 1s, and 2s in one pass.", "hint": "Three-way (Dutch national flag) partition with low, mid, high pointers.", "tests": "Three-way partitioning.", "link": "https://leetcode.com/problems/sort-colors/" },
    { "id": "qs4", "title": "Wiggle Sort II", "difficulty": "Hard", "statement": "Reorder so that nums[0] < nums[1] > nums[2] < ...", "hint": "Quickselect to find the median, then place small/large halves at even/odd indices.", "tests": "Quickselect + index mapping.", "link": "https://leetcode.com/problems/wiggle-sort-ii/" },
    { "id": "qs5", "title": "Top K Frequent Elements", "difficulty": "Medium", "statement": "Return the k most frequent elements.", "hint": "Count frequencies, then quickselect on frequency to isolate the top k in average O(n).", "tests": "Quickselect on a derived key.", "link": "https://leetcode.com/problems/top-k-frequent-elements/" }
  ]
}
