{
  "slug": "graph-dfs",
  "categoryId": "graphs",
  "order": 2,
  "title": "Depth-First Search (DFS)",
  "tagline": "Dive deep before backtracking — the basis of connectivity, cycles, and topological order.",
  "estMinutes": 16,
  "simulator": "graph-dfs",
  "complexity": { "time": "O(V + E)", "space": "O(V)" },
  "tags": ["graph", "recursion", "backtracking"],
  "intuition": {
    "analogy": "Exploring a cave with a ball of string: you follow one passage as far as it goes, and only when you hit a dead end do you backtrack along the string to the last junction and try another passage.",
    "paragraphs": [
      "DFS explores as deeply as possible along each branch before backtracking. Implemented with recursion (or an explicit stack), it naturally enumerates connected components and detects structure within a graph.",
      "Its real power is in what it reveals through timing: discovery/finish times expose cycles, topological order (post-order reversed), bridges, articulation points, and strongly connected components.",
      "Like BFS it runs in O(V+E), but it does NOT find shortest paths in general — its strength is structural analysis, not distance."
    ],
    "keyIdea": "Recurse into unvisited neighbours, backtracking at dead ends; visit order and finish order encode graph structure."
  },
  "logic": {
    "steps": [
      { "title": "Visit and mark", "detail": "On entering a node, mark it visited so you never re-enter it." },
      { "title": "Recurse into neighbours", "detail": "For each unvisited neighbour, recurse. This dives deep before exploring siblings." },
      { "title": "Backtrack", "detail": "When all neighbours are explored, return to the caller. Post-order (finish) time is recorded here — useful for topo sort and SCC." }
    ],
    "code": {
      "language": "python",
      "title": "dfs.py",
      "source": "def dfs(adj, u, visited, order):\n    visited.add(u)\n    for v in adj[u]:\n        if v not in visited:\n            dfs(adj, v, visited, order)\n    order.append(u)        # post-order / finish time"
    },
    "complexity": {
      "time": "O(V + E)",
      "timeReason": "Each vertex is entered once; each edge is examined once.",
      "space": "O(V)",
      "spaceReason": "Recursion stack and visited set, up to V deep/large."
    },
    "pitfalls": [
      "Recursion depth can overflow on large/deep graphs — use an explicit stack if needed.",
      "DFS does not yield shortest paths.",
      "For directed-cycle detection, track three colours (white/gray/black), not just a binary visited flag."
    ]
  },
  "dryRun": {
    "input": "DFS from 0 in 0-1, 0-2, 1-3, 1-4, 2-5, 4-6, 5-6",
    "columns": ["Action", "Stack/path", "Visited"],
    "rows": [
      ["enter 0", "0", "0"],
      ["enter 1", "0,1", "0,1"],
      ["enter 3", "0,1,3", "0,1,3 (dead end → back)"],
      ["enter 4→6→5", "0,1,4,6,5", "deep dive then backtrack to 2"]
    ],
    "clickMoment": "DFS commits fully to one branch (0→1→3) before ever touching node 2. The recursion stack IS the current root-to-node path — which is exactly why backtracking algorithms are DFS in disguise."
  },
  "problems": [
    { "id": "dfs1", "title": "Number of Provinces", "difficulty": "Medium", "statement": "Count connected components in a friendship matrix.", "hint": "DFS/union-find over the adjacency.", "tests": "Connected components.", "link": "https://leetcode.com/problems/number-of-provinces/" },
    { "id": "dfs2", "title": "Course Schedule", "difficulty": "Medium", "statement": "Detect if prerequisites contain a cycle.", "hint": "DFS with gray/black colouring detects a back edge (cycle).", "tests": "Directed cycle detection.", "link": "https://leetcode.com/problems/course-schedule/" },
    { "id": "dfs3", "title": "Pacific Atlantic Water Flow", "difficulty": "Medium", "statement": "Cells from which water can reach both oceans.", "hint": "DFS inward from each ocean's border.", "tests": "Multi-start DFS on grids.", "link": "https://leetcode.com/problems/pacific-atlantic-water-flow/" },
    { "id": "dfs4", "title": "Clone Graph", "difficulty": "Medium", "statement": "Deep-copy a connected undirected graph.", "hint": "DFS with a map from original to clone.", "tests": "DFS with memoised construction.", "link": "https://leetcode.com/problems/clone-graph/" },
    { "id": "dfs5", "title": "Critical Connections (Bridges)", "difficulty": "Hard", "statement": "Find all bridges in a network.", "hint": "DFS with discovery times and low-link values (Tarjan).", "tests": "DFS timing for bridges.", "link": "https://leetcode.com/problems/critical-connections-in-a-network/" }
  ]
}
